{
    "task_id": "ansible-issue-61176",
    "repository": {
        "name": "ansible",
        "owner": "ansible",
        "language_primary": "Python",
        "commit_hash_base": "c93085eece6b08226e42a70a66307334ad5c7888"
    },
    "problem_statement": {
        "title": "apt update_cache=yes Failed to lock apt for exclusive operation when /var/lib/apt/lists does not exist.",
        "description": "##### SUMMARY\r\n\r\nWhen `/var/lib/apt/lists/` does not exists, `update_cache=yes` will failed by:\r\n\r\n```json\r\n{\r\n    \"changed\": false,\r\n    \"msg\": \"Failed to lock apt for exclusive operation\"\r\n}\r\n```\r\n\r\nBut when I create the `/var/lib/apt/lists/` manually or just `apt-get update`, it works.\r\n\r\n##### ISSUE TYPE\r\n- Bug Report\r\n\r\n##### COMPONENT NAME\r\napt\r\n\r\n##### ANSIBLE VERSION\r\n<!--- Paste verbatim output from \"ansible --version\" between quotes -->\r\n```paste below\r\nansible 2.8.4\r\n  config file = /c/Users/fengyu/projects/ansible_playbooks/ansible.cfg\r\n  configured module search path = ['/c/Users/fengyu/.ansible/plugins/modules', '/usr/share/ansible/plugins/modules']\r\n  ansible python module location = /usr/lib/python3.7/site-packages/ansible\r\n  executable location = /usr/bin/ansible\r\n  python version = 3.7.4 (default, Jul 11 2019, 09:35:14) [GCC 9.1.0]\r\n```\r\n\r\n##### OS / ENVIRONMENT\r\ntarget OS: Ubuntu Server 18.04\r\n\r\n\r\n##### STEPS TO REPRODUCE\r\n\r\nHere is the recurrence:\r\n\r\n```bash\r\nrm -fr /var/lib/apt/lists\r\n# Failed\r\nansible -i hosts barn-new -m apt -a 'update_cache=yes'\r\n\r\nmkdir -p /var/lib/apt/lists/ \r\n# or\r\napt update\r\n# then\r\nansible -i hosts barn-new -m apt -a 'update_cache=yes'\r\n# { \"cache_update_time\": 1566483301, \"cache_updated\": true, \"changed\": true }\r\n```\r\n\r\n##### EXPECTED RESULTS\r\n\r\n`update_cache=yes` should automatic refresh cache by `apt-get update`.\r\n\r\n\r\n##### ACTUAL RESULTS\r\n```json\r\n{\r\n    \"changed\": false,\r\n    \"msg\": \"Failed to lock apt for exclusive operation\"\r\n}\r\n```\r\n",
        "target_files": []
    },
    "evaluation_criteria": {
        "gold_patch": "diff --git a/changelogs/fragments/apt_update.yml b/changelogs/fragments/apt_update.yml\nnew file mode 100644\nindex 00000000000000..45d5e38b6b2a2f\n--- /dev/null\n+++ b/changelogs/fragments/apt_update.yml\n@@ -0,0 +1,3 @@\n+---\n+bugfixes:\n+    - apt - recreate the APT lists directory (/var/lib/apt/lists by default) if missing (https://github.com/ansible/ansible/issues/61176).\ndiff --git a/lib/ansible/modules/apt.py b/lib/ansible/modules/apt.py\nindex ec3668b2ebf18d..5a10c4c3746074 100644\n--- a/lib/ansible/modules/apt.py\n+++ b/lib/ansible/modules/apt.py\n@@ -224,6 +224,7 @@\n    - If the interpreter can't import C(python3-apt) the module will check for it in system-owned interpreters as well.\n      If the dependency can't be found, depending on the value of O(auto_install_module_deps) the module will attempt to install it.\n      If the dependency is found or installed, the module will be respawned under the correct interpreter.\n+   - From ansible-core 2.21, if the apt lists directory is absent, the module will recreate it by running C(apt-get update).\n \"\"\"\n \n EXAMPLES = \"\"\"\n@@ -1197,6 +1198,17 @@ def get_updated_cache_time():\n     return mtimestamp, updated_cache_time\n \n \n+def recreate_cache(module, max_retries=2):\n+    retries = 0\n+    update_cmd = ['apt-get', 'update', '-q']\n+    while retries < max_retries:\n+        rc, stdout, stderr = module.run_command(update_cmd)\n+        retries += 1\n+        if rc == 0:\n+            break\n+    return rc, stdout, stderr\n+\n+\n # https://github.com/ansible/ansible-modules-core/issues/2951\n def get_cache(module):\n     \"\"\"Attempt to get the cache object and update till it works\"\"\"\n@@ -1206,18 +1218,20 @@ def get_cache(module):\n     except SystemError as e:\n         if '/var/lib/apt/lists/' in to_native(e).lower():\n             # update cache until files are fixed or retries exceeded\n-            retries = 0\n-            while retries < 2:\n-                (rc, so, se) = module.run_command(['apt-get', 'update', '-q'])\n-                retries += 1\n-                if rc == 0:\n-                    break\n+            rc, stdout, stderr = recreate_cache(module)\n             if rc != 0:\n-                module.fail_json(msg='Updating the cache to correct corrupt package lists failed:\\n%s\\n%s' % (to_native(e), so + se), rc=rc)\n+                module.fail_json(msg=f'Updating the cache to correct corrupt package lists failed:\\n{to_native(e)}\\n{stdout + stderr}', rc=rc)\n             # try again\n             cache = apt.Cache()\n         else:\n             module.fail_json(msg=to_native(e))\n+\n+    # Check if the cache is valid\n+    if not os.path.isdir(apt_pkg.config.find_dir(\"Dir::State::Lists\")):\n+        rc, stdout, stderr = recreate_cache(module)\n+        if rc != 0:\n+            module.fail_json(msg=f'Failed to recreate the cache: {stdout + stderr}', rc=rc)\n+        cache = apt.Cache()\n     return cache\n \n \n",
        "test_patch": "diff --git a/test/integration/targets/apt/tasks/apt_update.yml b/test/integration/targets/apt/tasks/apt_update.yml\nnew file mode 100644\nindex 00000000000000..e22e560f212208\n--- /dev/null\n+++ b/test/integration/targets/apt/tasks/apt_update.yml\n@@ -0,0 +1,24 @@\n+- block:\n+    - name: Create a backup of the /var/lib/apt/lists/partial\n+      command: mv /var/lib/apt/lists/partial /var/lib/apt/lists/partial.backup\n+\n+    - name: Verify that apt update does not fail if the /var/lib/apt/lists/partial is not present\n+      apt:\n+        update_cache: yes\n+\n+    - name: Create a backup of the /var/lib/apt/lists\n+      command: mv /var/lib/apt/lists /var/lib/apt/lists.backup\n+\n+    - name: Verify that apt update does not fail if the /var/lib/apt/lists is not present\n+      apt:\n+        update_cache: yes\n+\n+  always:\n+    - name: Check if the /var/lib/apt/lists is present\n+      stat:\n+        path: /var/lib/apt/lists.backup\n+      register: apt_lists_backup_stat\n+\n+    - name: Restore the /var/lib/apt/lists\n+      shell: rsync -a --delete /var/lib/apt/lists.backup/ /var/lib/apt/lists/ && rm -rf /var/lib/apt/lists.backup\n+      when: apt_lists_backup_stat.stat.exists\ndiff --git a/test/integration/targets/apt/tasks/main.yml b/test/integration/targets/apt/tasks/main.yml\nindex 4ae93219d69665..a820bdad267bf0 100644\n--- a/test/integration/targets/apt/tasks/main.yml\n+++ b/test/integration/targets/apt/tasks/main.yml\n@@ -30,6 +30,8 @@\n \n   - import_tasks: 'apt-builddep.yml'\n \n+  - import_tasks: 'apt_update.yml'\n+\n   - block:\n       - import_tasks: 'repo.yml'\n     always:\n",
        "success_command": "TODO: Inject repo-specific success command (e.g., 'npm map', 'go test ./...')",
        "complexity_flags": [
            "multi-file",
            "dependency-graph-verified"
        ]
    }
}