{
    "task_id": "ansible-issue-85542",
    "repository": {
        "name": "ansible",
        "owner": "ansible",
        "language_primary": "Python",
        "commit_hash_base": "c93085eece6b08226e42a70a66307334ad5c7888"
    },
    "problem_statement": {
        "title": "user module incorrectly reports success on Alpine when using unsupported seuser parameter",
        "description": "### Summary\n\nThe` ansible.builtin.user `module silently ignores the `seuser` parameter when run on Alpine Linux (BusyBox backend), but still reports `changed: true`, even though Alpine does not support the corresponding functionality (i.e., useradd -Z is unrecognized). This soundness issue can mislead users into thinking that SELinux-related options were applied, when in fact they are ignored.\n\n\n### Issue Type\n\nBug Report\n\n### Component Name\n\nuser\n\n### Ansible Version\n\n```console\n$ ansible --version\n\nansible [core 2.18.7]\n  config file = None\n  configured module search path = ['/root/.ansible/plugins/modules', '/usr/share/ansible/plugins/modules']\n  ansible python module location = /usr/lib/python3.12/site-packages/ansible\n  ansible collection location = /root/.ansible/collections:/usr/share/ansible/collections\n  executable location = /usr/bin/ansible\n  python version = 3.12.11 (main, Jun  9 2025, 08:58:46) [GCC 13.2.1 20240309] (/usr/bin/python3)\n  jinja version = 3.1.6\n  libyaml = True\n```\n\n### Configuration\n\n```console\n# if using a version older than ansible-core 2.12 you should omit the '-t all'\n$ ansible-config dump --only-changed -t all\n```\n\n### OS / Environment\n\nAlpine 3.20.6 & 3.21.3\n\n### Steps to Reproduce\n\nOn Alpine, run:\n<!--- Paste example playbooks or commands between quotes below -->\n```yaml (paste below)\n- hosts: localhost\n  connection: local\n  gather_facts: false\n  tasks:\n    - name: Try creating user with nonexistent SELinux user\n      ansible.builtin.user:\n        name: badseuser\n        seuser: nonexistent_u\n        state: present\n      register: result\n```\n\n\n### Expected Results\n\nWe would expect the task to fail, since Alpine is not a SELinux-enabled OS. In fact, the BusyBox version of useradd used on Alpine returns:\n\n```/ # useradd -Z nonexistent_u badseuser_cli\nuseradd: unrecognized option: Z\nUsage: useradd [options] LOGIN\n       useradd -D\n       useradd -D [options]\n....\n```\nFor some context, on other OSes (e.g. Ubuntu, Rocky, Debian, SUSE Leap, RHEL, Fedora) we get:\n\n```\nTASK [Try creating user with nonexistent SELinux user] **********************************************************************************************************************************************************\nfatal: [localhost]: FAILED! => {\"changed\": false, \"msg\": \"useradd: -Z requires SELinux enabled kernel\\n\", \"name\": \"badseuser\", \"rc\": 3}\n```\n\n### Actual Results\n\n```console\nTASK [Try creating user with nonexistent SELinux user] **********************************************************************************************************************************************************\nchanged: [localhost]\n```\n\n### Code of Conduct\n\n- [x] I agree to follow the Ansible Code of Conduct",
        "target_files": []
    },
    "evaluation_criteria": {
        "gold_patch": "diff --git a/changelogs/fragments/85542-user-seuser-warning.yml b/changelogs/fragments/85542-user-seuser-warning.yml\nnew file mode 100644\nindex 00000000000000..8076e91be73e89\n--- /dev/null\n+++ b/changelogs/fragments/85542-user-seuser-warning.yml\n@@ -0,0 +1,4 @@\n+bugfixes:\n+  - user - emit a warning when the ``seuser`` parameter is set on a system where\n+    SELinux is not enabled, instead of silently ignoring it\n+    (https://github.com/ansible/ansible/issues/85542).\ndiff --git a/lib/ansible/modules/user.py b/lib/ansible/modules/user.py\nindex 9909369502321f..06e512fd433a2e 100644\n--- a/lib/ansible/modules/user.py\n+++ b/lib/ansible/modules/user.py\n@@ -45,6 +45,8 @@\n     seuser:\n         description:\n             - Optionally sets the C(seuser) type C(user_u) on SELinux enabled systems.\n+            - This parameter is silently ignored on systems where SELinux is not enabled.\n+              A warning will be emitted in this case.\n         type: str\n         version_added: \"2.1\"\n     group:\n@@ -743,7 +745,7 @@ def create_user_useradd(self):\n             if self.non_unique:\n                 cmd.append('-o')\n \n-        if self.seuser is not None:\n+        if self.seuser is not None and self.module.selinux_enabled():\n             cmd.append('-Z')\n             cmd.append(self.seuser)\n         if self.group is not None:\n@@ -3425,6 +3427,12 @@ def main():\n     user = User(module)\n     user.check_password_encrypted()\n \n+    if user.seuser is not None and not module.selinux_enabled():\n+        module.warn(\n+            f\"'seuser' is set to '{user.seuser}' but SELinux is not enabled on \"\n+            f\"this system. The 'seuser' parameter will be ignored.\"\n+        )\n+\n     module.debug('User instantiated - platform %s' % user.platform)\n     if user.distribution:\n         module.debug('User instantiated - distribution %s' % user.distribution)\n",
        "test_patch": "diff --git a/test/integration/targets/user/tasks/main.yml b/test/integration/targets/user/tasks/main.yml\nindex 7d9831bd17beec..18633269cb329d 100644\n--- a/test/integration/targets/user/tasks/main.yml\n+++ b/test/integration/targets/user/tasks/main.yml\n@@ -34,4 +34,5 @@\n     - ansible_distribution != 'Alpine'\n - include_tasks: test_freebsd_nonexistent.yml\n   when: ansible_facts.system == 'FreeBSD'\n+- import_tasks: test_seuser_warning.yml\n - import_tasks: ssh_keygen.yml\ndiff --git a/test/integration/targets/user/tasks/test_seuser_warning.yml b/test/integration/targets/user/tasks/test_seuser_warning.yml\nnew file mode 100644\nindex 00000000000000..0914c6ddbe63cd\n--- /dev/null\n+++ b/test/integration/targets/user/tasks/test_seuser_warning.yml\n@@ -0,0 +1,24 @@\n+- name: test seuser parameter emits warning when SELinux is not enabled\n+  when: not ansible_facts.selinux.status is defined or ansible_facts.selinux.status != 'enabled'\n+  block:\n+    - name: create user with seuser on non-SELinux system\n+      user:\n+        name: ansibulluser_seuser\n+        state: present\n+        seuser: user_u\n+      register: user_seuser_result\n+\n+    - name: validate warning is emitted for seuser on non-SELinux system\n+      assert:\n+        that:\n+          - user_seuser_result.warnings is defined\n+          - user_seuser_result.warnings | length > 0\n+          - \"'seuser' in user_seuser_result.warnings[0]\"\n+          - \"'SELinux' in user_seuser_result.warnings[0]\"\n+          - \"'ignored' in user_seuser_result.warnings[0]\"\n+\n+  always:\n+    - name: remove test user\n+      user:\n+        name: ansibulluser_seuser\n+        state: absent\n",
        "success_command": "TODO: Inject repo-specific success command (e.g., 'npm map', 'go test ./...')",
        "complexity_flags": [
            "multi-file",
            "dependency-graph-verified"
        ]
    }
}