{
    "task_id": "kubernetes-issue-137687",
    "repository": {
        "name": "kubernetes",
        "owner": "kubernetes",
        "language_primary": "Go",
        "commit_hash_base": "e3c5ead23f5e3823f3140badeb7d1a0761413242"
    },
    "problem_statement": {
        "title": "beta-feature enabled clusters are broken in master",
        "description": "### Which jobs are failing?\n\nci-kubernetes-e2e-kind-beta-enabled \n\n### Which tests are failing?\n\nbreforesuite ... cluster is unhealthy\n\n### Since when has it been failing?\n\nmarch 12th\n\ndiff is https://github.com/kubernetes/kubernetes/compare/f7f694e5e...4e2bbc78b\n\n### Testgrid link\n\nhttps://testgrid.k8s.io/sig-release-master-informing#kind-master-beta-enabled\n\n### Reason for failure (if possible)\n\ntimes out waiting for cluster to be ready. will dig more in a moment\n\n### Anything else we need to know?\n\n_No response_\n\n### Relevant SIG(s)\n\n/sig testing",
        "target_files": []
    },
    "evaluation_criteria": {
        "gold_patch": "diff --git a/pkg/scheduler/scheduler.go b/pkg/scheduler/scheduler.go\nindex ce5aea1749cde..137a0b98b6d60 100644\n--- a/pkg/scheduler/scheduler.go\n+++ b/pkg/scheduler/scheduler.go\n@@ -336,7 +336,7 @@ func New(ctx context.Context,\n \t\t// If device taint rules are disabled, the additional informers are not needed and\n \t\t// the tracker turns into a simple wrapper around the slice informer.\n \t\tif resourceSliceTrackerOpts.EnableDeviceTaintRules {\n-\t\t\tresourceSliceTrackerOpts.TaintInformer = informerFactory.Resource().V1alpha3().DeviceTaintRules()\n+\t\t\tresourceSliceTrackerOpts.TaintInformer = informerFactory.Resource().V1beta2().DeviceTaintRules()\n \t\t\tresourceSliceTrackerOpts.ClassInformer = informerFactory.Resource().V1().DeviceClasses()\n \t\t}\n \t\tresourceSliceTracker, err = resourceslicetracker.StartTracker(ctx, resourceSliceTrackerOpts)\ndiff --git a/staging/src/k8s.io/dynamic-resource-allocation/resourceslice/tracker/tracker.go b/staging/src/k8s.io/dynamic-resource-allocation/resourceslice/tracker/tracker.go\nindex 953722a234fc2..9941a38c3f010 100644\n--- a/staging/src/k8s.io/dynamic-resource-allocation/resourceslice/tracker/tracker.go\n+++ b/staging/src/k8s.io/dynamic-resource-allocation/resourceslice/tracker/tracker.go\n@@ -31,7 +31,7 @@ import (\n \tutilruntime \"k8s.io/apimachinery/pkg/util/runtime\"\n \t\"k8s.io/apimachinery/pkg/util/sets\"\n \tresourceinformers \"k8s.io/client-go/informers/resource/v1\"\n-\tresourcealphainformers \"k8s.io/client-go/informers/resource/v1alpha3\"\n+\tresourcebetainformers \"k8s.io/client-go/informers/resource/v1beta2\"\n \t\"k8s.io/client-go/kubernetes\"\n \t\"k8s.io/client-go/kubernetes/scheme\"\n \tv1core \"k8s.io/client-go/kubernetes/typed/core/v1\"\n@@ -119,7 +119,7 @@ type Options struct {\n \tEnableConsumableCapacity bool\n \n \tSliceInformer resourceinformers.ResourceSliceInformer\n-\tTaintInformer resourcealphainformers.DeviceTaintRuleInformer\n+\tTaintInformer resourcebetainformers.DeviceTaintRuleInformer\n \tClassInformer resourceinformers.DeviceClassInformer\n \n \t// KubeClient is used to generate Events when CEL expressions\n",
        "test_patch": "diff --git a/pkg/scheduler/eventhandlers_test.go b/pkg/scheduler/eventhandlers_test.go\nindex 02cd4da43147f..5714b696ec318 100644\n--- a/pkg/scheduler/eventhandlers_test.go\n+++ b/pkg/scheduler/eventhandlers_test.go\n@@ -29,7 +29,7 @@ import (\n \tbatchv1 \"k8s.io/api/batch/v1\"\n \tv1 \"k8s.io/api/core/v1\"\n \tresourceapi \"k8s.io/api/resource/v1\"\n-\tresourcealphaapi \"k8s.io/api/resource/v1alpha3\"\n+\tresourcebetaapi \"k8s.io/api/resource/v1beta2\"\n \tschedulingapi \"k8s.io/api/scheduling/v1alpha2\"\n \tstoragev1 \"k8s.io/api/storage/v1\"\n \t\"k8s.io/apimachinery/pkg/api/resource\"\n@@ -521,13 +521,13 @@ func TestAddAllEventHandlers(t *testing.T) {\n \t\t\tenableDRADeviceTaints:     true,\n \t\t\tenableDRADeviceTaintRules: true,\n \t\t\texpectStaticInformers: map[reflect.Type]bool{\n-\t\t\t\treflect.TypeOf(&v1.Pod{}):                           true,\n-\t\t\t\treflect.TypeOf(&v1.Node{}):                          true,\n-\t\t\t\treflect.TypeOf(&v1.Namespace{}):                     true,\n-\t\t\t\treflect.TypeOf(&resourceapi.ResourceClaim{}):        true,\n-\t\t\t\treflect.TypeOf(&resourceapi.ResourceSlice{}):        true,\n-\t\t\t\treflect.TypeOf(&resourcealphaapi.DeviceTaintRule{}): true,\n-\t\t\t\treflect.TypeOf(&resourceapi.DeviceClass{}):          true,\n+\t\t\t\treflect.TypeOf(&v1.Pod{}):                          true,\n+\t\t\t\treflect.TypeOf(&v1.Node{}):                         true,\n+\t\t\t\treflect.TypeOf(&v1.Namespace{}):                    true,\n+\t\t\t\treflect.TypeOf(&resourceapi.ResourceClaim{}):       true,\n+\t\t\t\treflect.TypeOf(&resourceapi.ResourceSlice{}):       true,\n+\t\t\t\treflect.TypeOf(&resourcebetaapi.DeviceTaintRule{}): true,\n+\t\t\t\treflect.TypeOf(&resourceapi.DeviceClass{}):         true,\n \t\t\t},\n \t\t\texpectDynamicInformers: map[schema.GroupVersionResource]bool{},\n \t\t},\n@@ -658,7 +658,7 @@ func TestAddAllEventHandlers(t *testing.T) {\n \t\t\t\t\tSliceInformer:          informerFactory.Resource().V1().ResourceSlices(),\n \t\t\t\t}\n \t\t\t\tif opts.EnableDeviceTaintRules {\n-\t\t\t\t\topts.TaintInformer = informerFactory.Resource().V1alpha3().DeviceTaintRules()\n+\t\t\t\t\topts.TaintInformer = informerFactory.Resource().V1beta2().DeviceTaintRules()\n \t\t\t\t\topts.ClassInformer = informerFactory.Resource().V1().DeviceClasses()\n \n \t\t\t\t}\ndiff --git a/pkg/scheduler/framework/plugins/dynamicresources/dynamicresources_test.go b/pkg/scheduler/framework/plugins/dynamicresources/dynamicresources_test.go\nindex 17a0a3a23e58f..222fbbced2173 100644\n--- a/pkg/scheduler/framework/plugins/dynamicresources/dynamicresources_test.go\n+++ b/pkg/scheduler/framework/plugins/dynamicresources/dynamicresources_test.go\n@@ -3221,7 +3221,7 @@ func setup(tCtx ktesting.TContext, args *config.DynamicResourcesArgs, nodes []*v\n \tresourceSliceTrackerOpts := resourceslicetracker.Options{\n \t\tEnableDeviceTaintRules: true,\n \t\tSliceInformer:          tc.informerFactory.Resource().V1().ResourceSlices(),\n-\t\tTaintInformer:          tc.informerFactory.Resource().V1alpha3().DeviceTaintRules(),\n+\t\tTaintInformer:          tc.informerFactory.Resource().V1beta2().DeviceTaintRules(),\n \t\tClassInformer:          tc.informerFactory.Resource().V1().DeviceClasses(),\n \t\tKubeClient:             tc.client,\n \t}\ndiff --git a/pkg/scheduler/framework/plugins/noderesources/resource_allocation_test.go b/pkg/scheduler/framework/plugins/noderesources/resource_allocation_test.go\nindex 99c974ad9910a..98b0c3b472949 100644\n--- a/pkg/scheduler/framework/plugins/noderesources/resource_allocation_test.go\n+++ b/pkg/scheduler/framework/plugins/noderesources/resource_allocation_test.go\n@@ -591,7 +591,7 @@ func newTestDRAManager(tCtx ktesting.TContext, objects ...apiruntime.Object) *dy\n \tinformerFactory := informers.NewSharedInformerFactory(client, 0)\n \tresourceSliceTrackerOpts := tracker.Options{\n \t\tSliceInformer: informerFactory.Resource().V1().ResourceSlices(),\n-\t\tTaintInformer: informerFactory.Resource().V1alpha3().DeviceTaintRules(),\n+\t\tTaintInformer: informerFactory.Resource().V1beta2().DeviceTaintRules(),\n \t\tClassInformer: informerFactory.Resource().V1().DeviceClasses(),\n \t\tKubeClient:    client,\n \t}\ndiff --git a/staging/src/k8s.io/dynamic-resource-allocation/resourceslice/tracker/tracker_test.go b/staging/src/k8s.io/dynamic-resource-allocation/resourceslice/tracker/tracker_test.go\nindex e9233c23f98fc..8a5221eacbea8 100644\n--- a/staging/src/k8s.io/dynamic-resource-allocation/resourceslice/tracker/tracker_test.go\n+++ b/staging/src/k8s.io/dynamic-resource-allocation/resourceslice/tracker/tracker_test.go\n@@ -553,7 +553,7 @@ func TestListPatchedResourceSlices(t *testing.T) {\n \t\topts := Options{\n \t\t\tEnableDeviceTaintRules: true,\n \t\t\tSliceInformer:          informerFactory.Resource().V1().ResourceSlices(),\n-\t\t\tTaintInformer:          informerFactory.Resource().V1alpha3().DeviceTaintRules(),\n+\t\t\tTaintInformer:          informerFactory.Resource().V1beta2().DeviceTaintRules(),\n \t\t\tClassInformer:          informerFactory.Resource().V1().DeviceClasses(),\n \t\t\tKubeClient:             kubeClient,\n \t\t}\n@@ -961,7 +961,7 @@ func BenchmarkEventHandlers(b *testing.B) {\n \t\topts := Options{\n \t\t\tEnableDeviceTaintRules: true,\n \t\t\tSliceInformer:          informerFactory.Resource().V1().ResourceSlices(),\n-\t\t\tTaintInformer:          informerFactory.Resource().V1alpha3().DeviceTaintRules(),\n+\t\t\tTaintInformer:          informerFactory.Resource().V1beta2().DeviceTaintRules(),\n \t\t\tClassInformer:          informerFactory.Resource().V1().DeviceClasses(),\n \t\t\tKubeClient:             kubeClient,\n \t\t}\ndiff --git a/test/integration/scheduler_perf/dra.go b/test/integration/scheduler_perf/dra.go\nindex 71116c47ae73a..b56820504c31a 100644\n--- a/test/integration/scheduler_perf/dra.go\n+++ b/test/integration/scheduler_perf/dra.go\n@@ -291,7 +291,7 @@ func (op *allocResourceClaimsOp) run(tCtx ktesting.TContext) {\n \t\tKubeClient:               tCtx.Client(),\n \t}\n \tif resourceSliceTrackerOpts.EnableDeviceTaintRules {\n-\t\tresourceSliceTrackerOpts.TaintInformer = informerFactory.Resource().V1alpha3().DeviceTaintRules()\n+\t\tresourceSliceTrackerOpts.TaintInformer = informerFactory.Resource().V1beta2().DeviceTaintRules()\n \t\tresourceSliceTrackerOpts.ClassInformer = informerFactory.Resource().V1().DeviceClasses()\n \t}\n \tresourceSliceTracker, err := resourceslicetracker.StartTracker(tCtx, resourceSliceTrackerOpts)\n",
        "success_command": "TODO: Inject repo-specific success command (e.g., 'npm map', 'go test ./...')",
        "complexity_flags": [
            "multi-file",
            "dependency-graph-verified"
        ]
    }
}